transcript,audio_url,difficulty
"I made you a sandwich.","https://audio.tatoeba.org/sentences/eng/3821019.mp3","pending"
"I miss Mary's cooking.","https://audio.tatoeba.org/sentences/eng/2387236.mp3","pending"
"I must speak with you.","https://audio.tatoeba.org/sentences/eng/2387305.mp3","pending"
"I need to feed my dog.","https://audio.tatoeba.org/sentences/eng/2387593.mp3","pending"
"I need to talk to Tom.","https://audio.tatoeba.org/sentences/eng/2387756.mp3","pending"
"I never liked biology.","https://audio.tatoeba.org/sentences/eng/1317.mp3","pending"
"I never went to sleep.","https://audio.tatoeba.org/sentences/eng/1887605.mp3","pending"
"I play computer games.","https://audio.tatoeba.org/sentences/eng/567359.mp3","pending"
"I put it on your desk.","https://audio.tatoeba.org/sentences/eng/2389905.mp3","pending"
"I really should leave.","https://audio.tatoeba.org/sentences/eng/3635953.mp3","pending"
"I require your advice.","https://audio.tatoeba.org/sentences/eng/2404151.mp3","pending"
"I saw the car explode.","https://audio.tatoeba.org/sentences/eng/2406097.mp3","pending"
"I should've said that.","https://audio.tatoeba.org/sentences/eng/2406443.mp3","pending"
"I still don't like it.","https://audio.tatoeba.org/sentences/eng/1887689.mp3","pending"
"I suggest you ask Tom.","https://audio.tatoeba.org/sentences/eng/3144566.mp3","pending"
"I think it's too late.","https://audio.tatoeba.org/sentences/eng/3390685.mp3","pending"
"I think Tom is clever.","https://audio.tatoeba.org/sentences/eng/3171947.mp3","pending"
"I think Tom is polite.","https://audio.tatoeba.org/sentences/eng/3183907.mp3","pending"
"I think you need help.","https://audio.tatoeba.org/sentences/eng/2408626.mp3","pending"
"I thought he was sick.","https://audio.tatoeba.org/sentences/eng/260139.mp3","pending"
"I told Tom to do that.","https://audio.tatoeba.org/sentences/eng/2547392.mp3","pending"
"I used to be like Tom.","https://audio.tatoeba.org/sentences/eng/3330061.mp3","pending"
"I want more than that.","https://audio.tatoeba.org/sentences/eng/3374682.mp3","pending"
"I want to eat a mango.","https://audio.tatoeba.org/sentences/eng/1037573.mp3","pending"
"I want to lose weight.","https://audio.tatoeba.org/sentences/eng/259295.mp3","pending"
"I want to talk to Tom.","https://audio.tatoeba.org/sentences/eng/1887896.mp3","pending"
"I want you to do this.","https://audio.tatoeba.org/sentences/eng/2011686.mp3","pending"
"I wanted to apologize.","https://audio.tatoeba.org/sentences/eng/4530099.mp3","pending"
"I was happy yesterday.","https://audio.tatoeba.org/sentences/eng/257773.mp3","pending"
"I was truly impressed.","https://audio.tatoeba.org/sentences/eng/4499854.mp3","pending"
"I went home and cried.","https://audio.tatoeba.org/sentences/eng/2282102.mp3","pending"
"I went to the station.","https://audio.tatoeba.org/sentences/eng/256270.mp3","pending"
"I will return at 6:30.","https://audio.tatoeba.org/sentences/eng/892682.mp3","pending"
"I won't try to escape.","https://audio.tatoeba.org/sentences/eng/2276485.mp3","pending"
"I work at the airport.","https://audio.tatoeba.org/sentences/eng/2547330.mp3","pending"
"I would rather not go.","https://audio.tatoeba.org/sentences/eng/38011.mp3","pending"
"I'd like to buy a map.","https://audio.tatoeba.org/sentences/eng/455823.mp3","pending"
"I'll be busy all week.","https://audio.tatoeba.org/sentences/eng/4134945.mp3","pending"
"I'll be just a second.","https://audio.tatoeba.org/sentences/eng/3409358.mp3","pending"
"I'll explain it again.","https://audio.tatoeba.org/sentences/eng/2547285.mp3","pending"
"I'll give that to Tom.","https://audio.tatoeba.org/sentences/eng/2611576.mp3","pending"
"I'll miss you so much.","https://audio.tatoeba.org/sentences/eng/63377.mp3","pending"
"I'll show you my room.","https://audio.tatoeba.org/sentences/eng/251793.mp3","pending"
"I'll sign it tomorrow.","https://audio.tatoeba.org/sentences/eng/3329984.mp3","pending"
"I'm a little bit busy.","https://audio.tatoeba.org/sentences/eng/2646584.mp3","pending"
"I'm aware of all that.","https://audio.tatoeba.org/sentences/eng/2547230.mp3","pending"
"I'm busy all the time.","https://audio.tatoeba.org/sentences/eng/253162.mp3","pending"
"I'm glad Tom liked it.","https://audio.tatoeba.org/sentences/eng/3123332.mp3","pending"
"I'm going to be on TV.","https://audio.tatoeba.org/sentences/eng/2547208.mp3","pending"
"I'm going to the park.","https://audio.tatoeba.org/sentences/eng/931361.mp3","pending"
"I'm just doing my job.","https://audio.tatoeba.org/sentences/eng/1039156.mp3","pending"
"I'm not a big spender.","https://audio.tatoeba.org/sentences/eng/3342891.mp3","pending"
"I'm not afraid to die.","https://audio.tatoeba.org/sentences/eng/2547172.mp3","pending"
"I'm not going to lose.","https://audio.tatoeba.org/sentences/eng/2547163.mp3","pending"
"I'm not young anymore.","https://audio.tatoeba.org/sentences/eng/2547146.mp3","pending"
"I'm on my lunch break.","https://audio.tatoeba.org/sentences/eng/2179171.mp3","pending"
"I'm still in training.","https://audio.tatoeba.org/sentences/eng/2547118.mp3","pending"
"I'm talking about you.","https://audio.tatoeba.org/sentences/eng/2670282.mp3","pending"
"I'm used to it by now.","https://audio.tatoeba.org/sentences/eng/2547089.mp3","pending"
"I'm writing about you.","https://audio.tatoeba.org/sentences/eng/2547084.mp3","pending"
"I've been here before.","https://audio.tatoeba.org/sentences/eng/440092.mp3","pending"
"I've got a better one.","https://audio.tatoeba.org/sentences/eng/2891405.mp3","pending"
"I've got a lot to say.","https://audio.tatoeba.org/sentences/eng/3374703.mp3","pending"
"I've made a discovery.","https://audio.tatoeba.org/sentences/eng/929409.mp3","pending"
"I've seen that before.","https://audio.tatoeba.org/sentences/eng/2360247.mp3","pending"
"Is it all right to go?","https://audio.tatoeba.org/sentences/eng/3428598.mp3","pending"
"Is it really worth it?","https://audio.tatoeba.org/sentences/eng/794169.mp3","pending"
"Is that what you want?","https://audio.tatoeba.org/sentences/eng/1673143.mp3","pending"
"Is the island sinking?","https://audio.tatoeba.org/sentences/eng/3820803.mp3","pending"
"Is this your daughter?","https://audio.tatoeba.org/sentences/eng/3825478.mp3","pending"
"Is Tom still swimming?","https://audio.tatoeba.org/sentences/eng/2953030.mp3","pending"
"Isn't that right, Tom?","https://audio.tatoeba.org/sentences/eng/2646571.mp3","pending"
"It could still happen.","https://audio.tatoeba.org/sentences/eng/3129300.mp3","pending"
"It might be expensive.","https://audio.tatoeba.org/sentences/eng/2518399.mp3","pending"
"It tastes really good.","https://audio.tatoeba.org/sentences/eng/402339.mp3","pending"
"It was hot last night.","https://audio.tatoeba.org/sentences/eng/244845.mp3","pending"
"It was three days ago.","https://audio.tatoeba.org/sentences/eng/42824.mp3","pending"
"It was very difficult.","https://audio.tatoeba.org/sentences/eng/37769.mp3","pending"
"It's a common mistake.","https://audio.tatoeba.org/sentences/eng/20876.mp3","pending"
"It's a quarter to two.","https://audio.tatoeba.org/sentences/eng/2136090.mp3","pending"
"It's been a hard year.","https://audio.tatoeba.org/sentences/eng/1894598.mp3","pending"
"It's my favorite food.","https://audio.tatoeba.org/sentences/eng/42850.mp3","pending"
"It's probably a virus.","https://audio.tatoeba.org/sentences/eng/3178626.mp3","pending"
"It's tough to explain.","https://audio.tatoeba.org/sentences/eng/3734910.mp3","pending"
"Just do what you want.","https://audio.tatoeba.org/sentences/eng/3818739.mp3","pending"
"Just stay out of this.","https://audio.tatoeba.org/sentences/eng/3184947.mp3","pending"
"Keep in touch with me.","https://audio.tatoeba.org/sentences/eng/38259.mp3","pending"
"Leave my camera alone.","https://audio.tatoeba.org/sentences/eng/33563.mp3","pending"
"Let me fix the switch.","https://audio.tatoeba.org/sentences/eng/249689.mp3","pending"
"Let sleeping dogs lie.","https://audio.tatoeba.org/sentences/eng/30212.mp3","pending"
"Let's get ready to go.","https://audio.tatoeba.org/sentences/eng/1894544.mp3","pending"
"Let's leave her alone.","https://audio.tatoeba.org/sentences/eng/317568.mp3","pending"
"Let's move it, people.","https://audio.tatoeba.org/sentences/eng/3392627.mp3","pending"
"Let's start with beer.","https://audio.tatoeba.org/sentences/eng/1090076.mp3","pending"
"Let's take the subway.","https://audio.tatoeba.org/sentences/eng/277075.mp3","pending"
"Look at that mountain.","https://audio.tatoeba.org/sentences/eng/68358.mp3","pending"
"Make yourself at home.","https://audio.tatoeba.org/sentences/eng/2378.mp3","pending"
"May I borrow your pen?","https://audio.tatoeba.org/sentences/eng/33778.mp3","pending"
"May I turn off the TV?","https://audio.tatoeba.org/sentences/eng/1740487.mp3","pending"
"Move your car, please.","https://audio.tatoeba.org/sentences/eng/265620.mp3","pending"
"My father is a doctor.","https://audio.tatoeba.org/sentences/eng/251657.mp3","pending"
"My father loves pizza.","https://audio.tatoeba.org/sentences/eng/469183.mp3","pending"
"My name's on the door.","https://audio.tatoeba.org/sentences/eng/2646551.mp3","pending"
"My phone is vibrating.","https://audio.tatoeba.org/sentences/eng/1690156.mp3","pending"
"My suitcase is broken.","https://audio.tatoeba.org/sentences/eng/250589.mp3","pending"
"No one knew who I was.","https://audio.tatoeba.org/sentences/eng/2091155.mp3","pending"
"No one's denying that.","https://audio.tatoeba.org/sentences/eng/3374684.mp3","pending"
"Nobody listened to me.","https://audio.tatoeba.org/sentences/eng/276627.mp3","pending"
"None of us is perfect.","https://audio.tatoeba.org/sentences/eng/28773.mp3","pending"
"Our team won the game.","https://audio.tatoeba.org/sentences/eng/23458.mp3","pending"
"Please close the door.","https://audio.tatoeba.org/sentences/eng/495838.mp3","pending"
"Please come right now.","https://audio.tatoeba.org/sentences/eng/2782452.mp3","pending"
"Please go to the bank.","https://audio.tatoeba.org/sentences/eng/18441.mp3","pending"
"Please take this away.","https://audio.tatoeba.org/sentences/eng/2452023.mp3","pending"
"Please turn on the TV.","https://audio.tatoeba.org/sentences/eng/39143.mp3","pending"
"Put your weapons down.","https://audio.tatoeba.org/sentences/eng/3155584.mp3","pending"
"See you at the office.","https://audio.tatoeba.org/sentences/eng/2646543.mp3","pending"
"She asked for my help.","https://audio.tatoeba.org/sentences/eng/798665.mp3","pending"
"She handed him a book.","https://audio.tatoeba.org/sentences/eng/887172.mp3","pending"
"She held out her hand.","https://audio.tatoeba.org/sentences/eng/314874.mp3","pending"
"She is about to leave.","https://audio.tatoeba.org/sentences/eng/314958.mp3","pending"
"She lived a long life.","https://audio.tatoeba.org/sentences/eng/315868.mp3","pending"
"She told him to study.","https://audio.tatoeba.org/sentences/eng/887460.mp3","pending"
"She's in the restroom.","https://audio.tatoeba.org/sentences/eng/523175.mp3","pending"
"She's sure to succeed.","https://audio.tatoeba.org/sentences/eng/1327568.mp3","pending"
"Sit back and enjoy it.","https://audio.tatoeba.org/sentences/eng/3222964.mp3","pending"
"So you give up, right?","https://audio.tatoeba.org/sentences/eng/53214.mp3","pending"
"Someone's at the door.","https://audio.tatoeba.org/sentences/eng/2547070.mp3","pending"
"Sorry, I've got to go.","https://audio.tatoeba.org/sentences/eng/56371.mp3","pending"
"Summer is almost over.","https://audio.tatoeba.org/sentences/eng/2547069.mp3","pending"
"Tell me what you want.","https://audio.tatoeba.org/sentences/eng/25020.mp3","pending"
"Tell Tom how you feel.","https://audio.tatoeba.org/sentences/eng/3126591.mp3","pending"
"Thanks for telling me.","https://audio.tatoeba.org/sentences/eng/3722671.mp3","pending"
"Thanks, but no thanks.","https://audio.tatoeba.org/sentences/eng/67362.mp3","pending"
"That is an old camera.","https://audio.tatoeba.org/sentences/eng/67072.mp3","pending"
"That one is very rare.","https://audio.tatoeba.org/sentences/eng/4242166.mp3","pending"
"That was a cheap shot.","https://audio.tatoeba.org/sentences/eng/1533843.mp3","pending"
"That was very hurtful.","https://audio.tatoeba.org/sentences/eng/3724738.mp3","pending"
"That would be perfect.","https://audio.tatoeba.org/sentences/eng/2868966.mp3","pending"
"That's all you can do.","https://audio.tatoeba.org/sentences/eng/2892026.mp3","pending"
"That's just an excuse.","https://audio.tatoeba.org/sentences/eng/41462.mp3","pending"
"That's not your fault.","https://audio.tatoeba.org/sentences/eng/3428312.mp3","pending"
"That's what I thought.","https://audio.tatoeba.org/sentences/eng/271588.mp3","pending"
"The air here is clean.","https://audio.tatoeba.org/sentences/eng/3734734.mp3","pending"
"The bookstore is open.","https://audio.tatoeba.org/sentences/eng/462596.mp3","pending"
"The container is full.","https://audio.tatoeba.org/sentences/eng/1116338.mp3","pending"
"The doors were locked.","https://audio.tatoeba.org/sentences/eng/4500718.mp3","pending"
"The girl smiled at me.","https://audio.tatoeba.org/sentences/eng/46446.mp3","pending"
"The milk has gone bad.","https://audio.tatoeba.org/sentences/eng/19478.mp3","pending"
"The note was from Tom.","https://audio.tatoeba.org/sentences/eng/3734607.mp3","pending"
"The rest will be easy.","https://audio.tatoeba.org/sentences/eng/3737545.mp3","pending"
"The situation is dire.","https://audio.tatoeba.org/sentences/eng/2209602.mp3","pending"
"The sun is going down.","https://audio.tatoeba.org/sentences/eng/275033.mp3","pending"
"The wind blew all day.","https://audio.tatoeba.org/sentences/eng/319700.mp3","pending"
"There is no ambiguity.","https://audio.tatoeba.org/sentences/eng/4494587.mp3","pending"
"There was no swelling.","https://audio.tatoeba.org/sentences/eng/4502471.mp3","pending"
"These shoes are Tom's.","https://audio.tatoeba.org/sentences/eng/1027285.mp3","pending"
"They are the same age.","https://audio.tatoeba.org/sentences/eng/307243.mp3","pending"
"They could be drugged.","https://audio.tatoeba.org/sentences/eng/2646516.mp3","pending"
"They made fun of Mary.","https://audio.tatoeba.org/sentences/eng/293019.mp3","pending"
"They must be brothers.","https://audio.tatoeba.org/sentences/eng/4494582.mp3","pending"
"They trust each other.","https://audio.tatoeba.org/sentences/eng/1669494.mp3","pending"
"They were not invited.","https://audio.tatoeba.org/sentences/eng/1875956.mp3","pending"
"They'll never give up.","https://audio.tatoeba.org/sentences/eng/3151277.mp3","pending"
"They're ready for you.","https://audio.tatoeba.org/sentences/eng/2646506.mp3","pending"
"This bag is too heavy.","https://audio.tatoeba.org/sentences/eng/4328913.mp3","pending"
"This is a catastrophe.","https://audio.tatoeba.org/sentences/eng/2547047.mp3","pending"
"This is all a mistake.","https://audio.tatoeba.org/sentences/eng/2892185.mp3","pending"
"This is not a mistake.","https://audio.tatoeba.org/sentences/eng/2713589.mp3","pending"
"This is the good kind.","https://audio.tatoeba.org/sentences/eng/3721909.mp3","pending"
"This is their problem.","https://audio.tatoeba.org/sentences/eng/4494571.mp3","pending"
"This road is terrible.","https://audio.tatoeba.org/sentences/eng/4824069.mp3","pending"
"This should be useful.","https://audio.tatoeba.org/sentences/eng/2805728.mp3","pending"
"Those photos are hers.","https://audio.tatoeba.org/sentences/eng/67012.mp3","pending"
"Tom and I are friends.","https://audio.tatoeba.org/sentences/eng/37370.mp3","pending"
"Tom and I have a plan.","https://audio.tatoeba.org/sentences/eng/2646484.mp3","pending"
"Tom became very angry.","https://audio.tatoeba.org/sentences/eng/4495982.mp3","pending"
"Tom begged me to come.","https://audio.tatoeba.org/sentences/eng/3765202.mp3","pending"
"Tom can't afford that.","https://audio.tatoeba.org/sentences/eng/2646461.mp3","pending"
"Tom can't play tennis.","https://audio.tatoeba.org/sentences/eng/37238.mp3","pending"
"Tom caught three fish.","https://audio.tatoeba.org/sentences/eng/3923014.mp3","pending"
"Tom couldn't get that.","https://audio.tatoeba.org/sentences/eng/2646445.mp3","pending"
"Tom did it, didn't he?","https://audio.tatoeba.org/sentences/eng/1868396.mp3","pending"
"Tom did that for Mary.","https://audio.tatoeba.org/sentences/eng/3444442.mp3","pending"
"Tom didn't write back.","https://audio.tatoeba.org/sentences/eng/2272435.mp3","pending"
"Tom doesn't like beef.","https://audio.tatoeba.org/sentences/eng/1026056.mp3","pending"
"Tom doesn't look evil.","https://audio.tatoeba.org/sentences/eng/2272456.mp3","pending"
"Tom dropped his glass.","https://audio.tatoeba.org/sentences/eng/3923009.mp3","pending"
"Tom got in Mary's way.","https://audio.tatoeba.org/sentences/eng/2547026.mp3","pending"
"Tom got some bad news.","https://audio.tatoeba.org/sentences/eng/3413285.mp3","pending"
"Tom has a good memory.","https://audio.tatoeba.org/sentences/eng/1025487.mp3","pending"
"Tom has already eaten.","https://audio.tatoeba.org/sentences/eng/1830417.mp3","pending"
"Tom has been studying.","https://audio.tatoeba.org/sentences/eng/2272698.mp3","pending"
"Tom has straight hair.","https://audio.tatoeba.org/sentences/eng/2547014.mp3","pending"
"Tom heard Mary scream.","https://audio.tatoeba.org/sentences/eng/1028678.mp3","pending"
"Tom hid under the bed.","https://audio.tatoeba.org/sentences/eng/1025224.mp3","pending"
"Tom is a handsome guy.","https://audio.tatoeba.org/sentences/eng/2462687.mp3","pending"
"Tom is a quadriplegic.","https://audio.tatoeba.org/sentences/eng/2646401.mp3","pending"
"Tom is always reading.","https://audio.tatoeba.org/sentences/eng/3921187.mp3","pending"
"Tom is away on a trip.","https://audio.tatoeba.org/sentences/eng/3405212.mp3","pending"
"Tom is drinking water.","https://audio.tatoeba.org/sentences/eng/3157850.mp3","pending"
"Tom is grouse hunting.","https://audio.tatoeba.org/sentences/eng/2273192.mp3","pending"
"Tom is in his bedroom.","https://audio.tatoeba.org/sentences/eng/2546997.mp3","pending"
"Tom is neat, isn't he?","https://audio.tatoeba.org/sentences/eng/3417080.mp3","pending"
"Tom is obviously sick.","https://audio.tatoeba.org/sentences/eng/3185577.mp3","pending"
"Tom is quite careless.","https://audio.tatoeba.org/sentences/eng/3422188.mp3","pending"
"Tom is ugly, isn't he?","https://audio.tatoeba.org/sentences/eng/3416792.mp3","pending"
"Tom is very inventive.","https://audio.tatoeba.org/sentences/eng/3439392.mp3","pending"
"Tom is young at heart.","https://audio.tatoeba.org/sentences/eng/3434278.mp3","pending"
"Tom isn't so gullible.","https://audio.tatoeba.org/sentences/eng/1093390.mp3","pending"
"Tom killed the spider.","https://audio.tatoeba.org/sentences/eng/1463097.mp3","pending"
"Tom let Mary kiss him.","https://audio.tatoeba.org/sentences/eng/2483330.mp3","pending"
"Tom likes being alone.","https://audio.tatoeba.org/sentences/eng/1024577.mp3","pending"
"Tom looked very happy.","https://audio.tatoeba.org/sentences/eng/1024536.mp3","pending"
"Tom made for the exit.","https://audio.tatoeba.org/sentences/eng/2646348.mp3","pending"
"Tom may not be hungry.","https://audio.tatoeba.org/sentences/eng/2646345.mp3","pending"
"Tom never got married.","https://audio.tatoeba.org/sentences/eng/1164368.mp3","pending"
"Tom opened the drawer.","https://audio.tatoeba.org/sentences/eng/3735656.mp3","pending"
"Tom ran at full speed.","https://audio.tatoeba.org/sentences/eng/3056611.mp3","pending"
"Tom rinsed the dishes.","https://audio.tatoeba.org/sentences/eng/2546968.mp3","pending"
"Tom said to say hello.","https://audio.tatoeba.org/sentences/eng/2646322.mp3","pending"
"Tom seems to be angry.","https://audio.tatoeba.org/sentences/eng/3417621.mp3","pending"
"Tom should do nothing.","https://audio.tatoeba.org/sentences/eng/4497946.mp3","pending"
"Tom sipped his coffee.","https://audio.tatoeba.org/sentences/eng/2273671.mp3","pending"
"Tom still lives there.","https://audio.tatoeba.org/sentences/eng/4500708.mp3","pending"
"Tom thanked them both.","https://audio.tatoeba.org/sentences/eng/4502585.mp3","pending"
"Tom tipped the waiter.","https://audio.tatoeba.org/sentences/eng/1141113.mp3","pending"
"Tom twisted his ankle.","https://audio.tatoeba.org/sentences/eng/1141070.mp3","pending"
"Tom wanted to see you.","https://audio.tatoeba.org/sentences/eng/2011709.mp3","pending"
"Tom was an accountant.","https://audio.tatoeba.org/sentences/eng/2646275.mp3","pending"
"Tom was left for dead.","https://audio.tatoeba.org/sentences/eng/1498833.mp3","pending"
"Tom was very decisive.","https://audio.tatoeba.org/sentences/eng/4494551.mp3","pending"
"Tom went on an errand.","https://audio.tatoeba.org/sentences/eng/2780732.mp3","pending"
"Tom will soon be home.","https://audio.tatoeba.org/sentences/eng/3733153.mp3","pending"
"Tom won't let you pay.","https://audio.tatoeba.org/sentences/eng/2646267.mp3","pending"
"Tom's dog barks a lot.","https://audio.tatoeba.org/sentences/eng/2546918.mp3","pending"
"Tomorrow is a holiday.","https://audio.tatoeba.org/sentences/eng/323278.mp3","pending"
"Try to enjoy yourself.","https://audio.tatoeba.org/sentences/eng/2483168.mp3","pending"
"We agreed to help Tom.","https://audio.tatoeba.org/sentences/eng/3921329.mp3","pending"
"We aren't that stupid.","https://audio.tatoeba.org/sentences/eng/3820509.mp3","pending"
"We climbed the stairs.","https://audio.tatoeba.org/sentences/eng/2806257.mp3","pending"
"We didn't see anybody.","https://audio.tatoeba.org/sentences/eng/2092474.mp3","pending"
"We had lunch together.","https://audio.tatoeba.org/sentences/eng/2821605.mp3","pending"
"We have time to spare.","https://audio.tatoeba.org/sentences/eng/387442.mp3","pending"
"We helped one another.","https://audio.tatoeba.org/sentences/eng/248661.mp3","pending"
"We knelt down to pray.","https://audio.tatoeba.org/sentences/eng/304885.mp3","pending"
"We must work together.","https://audio.tatoeba.org/sentences/eng/3178397.mp3","pending"
"We need to train more.","https://audio.tatoeba.org/sentences/eng/3822266.mp3","pending"
"We sometimes see them.","https://audio.tatoeba.org/sentences/eng/400279.mp3","pending"
"We used to be married.","https://audio.tatoeba.org/sentences/eng/3312925.mp3","pending"
"We were all so hungry.","https://audio.tatoeba.org/sentences/eng/2646247.mp3","pending"
"We'll come by tonight.","https://audio.tatoeba.org/sentences/eng/3311982.mp3","pending"
"We'll see to it later.","https://audio.tatoeba.org/sentences/eng/3312151.mp3","pending"
"We're doing just fine.","https://audio.tatoeba.org/sentences/eng/3311117.mp3","pending"
"We're late for school.","https://audio.tatoeba.org/sentences/eng/2546894.mp3","pending"
"We're waiting for Tom.","https://audio.tatoeba.org/sentences/eng/3310987.mp3","pending"
"We're waiting for you.","https://audio.tatoeba.org/sentences/eng/3310942.mp3","pending"
"We've never needed it.","https://audio.tatoeba.org/sentences/eng/2646230.mp3","pending"
"Well, let's get going!","https://audio.tatoeba.org/sentences/eng/410595.mp3","pending"
"What are the symptoms?","https://audio.tatoeba.org/sentences/eng/37571.mp3","pending"
"What are you implying?","https://audio.tatoeba.org/sentences/eng/38923.mp3","pending"
"What did he look like?","https://audio.tatoeba.org/sentences/eng/2263441.mp3","pending"
"What did you just say?","https://audio.tatoeba.org/sentences/eng/1542551.mp3","pending"
"What did you tell Tom?","https://audio.tatoeba.org/sentences/eng/1839613.mp3","pending"
"What does your son do?","https://audio.tatoeba.org/sentences/eng/274383.mp3","pending"
"What else do you have?","https://audio.tatoeba.org/sentences/eng/1920679.mp3","pending"
"What if Tom finds out?","https://audio.tatoeba.org/sentences/eng/3050617.mp3","pending"
"What is going on here?","https://audio.tatoeba.org/sentences/eng/1886729.mp3","pending"
"What on earth is that?","https://audio.tatoeba.org/sentences/eng/3256353.mp3","pending"
"What was your mission?","https://audio.tatoeba.org/sentences/eng/2646207.mp3","pending"
"What's all this noise?","https://audio.tatoeba.org/sentences/eng/1797704.mp3","pending"
"What's in these boxes?","https://audio.tatoeba.org/sentences/eng/3738462.mp3","pending"
"What's wrong with Tom?","https://audio.tatoeba.org/sentences/eng/3042187.mp3","pending"
"What's your real name?","https://audio.tatoeba.org/sentences/eng/3636332.mp3","pending"
"When did you find out?","https://audio.tatoeba.org/sentences/eng/1839626.mp3","pending"
"When do I get my turn?","https://audio.tatoeba.org/sentences/eng/3405175.mp3","pending"
"When will they arrive?","https://audio.tatoeba.org/sentences/eng/66016.mp3","pending"
"Where are the showers?","https://audio.tatoeba.org/sentences/eng/1663.mp3","pending"
"Where did you find it?","https://audio.tatoeba.org/sentences/eng/1203151.mp3","pending"
"Where did you hide it?","https://audio.tatoeba.org/sentences/eng/3636475.mp3","pending"
"Where is the elevator?","https://audio.tatoeba.org/sentences/eng/65239.mp3","pending"
"Where will you put it?","https://audio.tatoeba.org/sentences/eng/3439469.mp3","pending"
"Where's your son, Tom?","https://audio.tatoeba.org/sentences/eng/2646180.mp3","pending"
"Which theater is that?","https://audio.tatoeba.org/sentences/eng/42668.mp3","pending"
"Who did you talk with?","https://audio.tatoeba.org/sentences/eng/1042637.mp3","pending"
"Who is that old woman?","https://audio.tatoeba.org/sentences/eng/67781.mp3","pending"
"Who told you about us?","https://audio.tatoeba.org/sentences/eng/3199904.mp3","pending"
"Who's got the tickets?","https://audio.tatoeba.org/sentences/eng/2892884.mp3","pending"
"Whose books are those?","https://audio.tatoeba.org/sentences/eng/66999.mp3","pending"
"Whose side are you on?","https://audio.tatoeba.org/sentences/eng/1886543.mp3","pending"
"Why are you in Boston?","https://audio.tatoeba.org/sentences/eng/2646169.mp3","pending"
"Why did you come here?","https://audio.tatoeba.org/sentences/eng/392144.mp3","pending"
"Why did you lie to us?","https://audio.tatoeba.org/sentences/eng/3403418.mp3","pending"
