transcript,audio_url,difficulty
"Don't put it on my desk.","https://audio.tatoeba.org/sentences/eng/25531.mp3","pending"
"Don't touch that button!","https://audio.tatoeba.org/sentences/eng/33426.mp3","pending"
"Don't worry. I'll do it.","https://audio.tatoeba.org/sentences/eng/502329.mp3","pending"
"Don't you like swimming?","https://audio.tatoeba.org/sentences/eng/3738018.mp3","pending"
"Even a child knows that.","https://audio.tatoeba.org/sentences/eng/2136105.mp3","pending"
"Everyone can see it now.","https://audio.tatoeba.org/sentences/eng/3130341.mp3","pending"
"Everyone pointed at Tom.","https://audio.tatoeba.org/sentences/eng/2261245.mp3","pending"
"Exactly how old are you?","https://audio.tatoeba.org/sentences/eng/3818094.mp3","pending"
"Get me a ticket, please.","https://audio.tatoeba.org/sentences/eng/272483.mp3","pending"
"Give Tom some room here.","https://audio.tatoeba.org/sentences/eng/3151428.mp3","pending"
"Give us a demonstration.","https://audio.tatoeba.org/sentences/eng/2645527.mp3","pending"
"Have I ever lied to you?","https://audio.tatoeba.org/sentences/eng/3163228.mp3","pending"
"Have you been there yet?","https://audio.tatoeba.org/sentences/eng/3059208.mp3","pending"
"Have you heard the news?","https://audio.tatoeba.org/sentences/eng/3738580.mp3","pending"
"Have you seen the paper?","https://audio.tatoeba.org/sentences/eng/3096242.mp3","pending"
"He asked us to help him.","https://audio.tatoeba.org/sentences/eng/476446.mp3","pending"
"He can read pretty well.","https://audio.tatoeba.org/sentences/eng/388979.mp3","pending"
"He doesn't know English.","https://audio.tatoeba.org/sentences/eng/1345510.mp3","pending"
"He finally got his wish.","https://audio.tatoeba.org/sentences/eng/291966.mp3","pending"
"He has already said yes.","https://audio.tatoeba.org/sentences/eng/290307.mp3","pending"
"He is a tennis champion.","https://audio.tatoeba.org/sentences/eng/291868.mp3","pending"
"He is known to everyone.","https://audio.tatoeba.org/sentences/eng/301400.mp3","pending"
"He looked up at the sky.","https://audio.tatoeba.org/sentences/eng/295588.mp3","pending"
"He ordered a cup of tea.","https://audio.tatoeba.org/sentences/eng/296335.mp3","pending"
"He stuck to his promise.","https://audio.tatoeba.org/sentences/eng/304295.mp3","pending"
"He wrote to his parents.","https://audio.tatoeba.org/sentences/eng/304723.mp3","pending"
"Help me hide this money.","https://audio.tatoeba.org/sentences/eng/3822292.mp3","pending"
"His handwriting is poor.","https://audio.tatoeba.org/sentences/eng/298357.mp3","pending"
"Home prices are surging.","https://audio.tatoeba.org/sentences/eng/4501540.mp3","pending"
"How could you forget it?","https://audio.tatoeba.org/sentences/eng/4666674.mp3","pending"
"How do you go to school?","https://audio.tatoeba.org/sentences/eng/38327.mp3","pending"
"How far is it from here?","https://audio.tatoeba.org/sentences/eng/62119.mp3","pending"
"How long was your visit?","https://audio.tatoeba.org/sentences/eng/3738734.mp3","pending"
"How's the weather there?","https://audio.tatoeba.org/sentences/eng/50753.mp3","pending"
"I almost started to cry.","https://audio.tatoeba.org/sentences/eng/3825510.mp3","pending"
"I am the fastest runner.","https://audio.tatoeba.org/sentences/eng/257652.mp3","pending"
"I arrived two weeks ago.","https://audio.tatoeba.org/sentences/eng/2169044.mp3","pending"
"I bet you can't do this.","https://audio.tatoeba.org/sentences/eng/3096307.mp3","pending"
"I came at Tom's request.","https://audio.tatoeba.org/sentences/eng/2300210.mp3","pending"
"I can do this all night.","https://audio.tatoeba.org/sentences/eng/2300681.mp3","pending"
"I can't change who I am.","https://audio.tatoeba.org/sentences/eng/1951399.mp3","pending"
"I can't do this anymore.","https://audio.tatoeba.org/sentences/eng/1887122.mp3","pending"
"I can't live without TV.","https://audio.tatoeba.org/sentences/eng/1230703.mp3","pending"
"I can't stand hospitals.","https://audio.tatoeba.org/sentences/eng/1954889.mp3","pending"
"I consider myself lucky.","https://audio.tatoeba.org/sentences/eng/4496879.mp3","pending"
"I couldn't convince Tom.","https://audio.tatoeba.org/sentences/eng/4134482.mp3","pending"
"I danced all night long.","https://audio.tatoeba.org/sentences/eng/1721230.mp3","pending"
"I didn't get one either.","https://audio.tatoeba.org/sentences/eng/3168255.mp3","pending"
"I didn't start all this.","https://audio.tatoeba.org/sentences/eng/2275937.mp3","pending"
"I didn't understand Tom.","https://audio.tatoeba.org/sentences/eng/2271767.mp3","pending"
"I don't deserve to live.","https://audio.tatoeba.org/sentences/eng/2275976.mp3","pending"
"I don't enjoy traveling.","https://audio.tatoeba.org/sentences/eng/2271839.mp3","pending"
"I don't have the energy.","https://audio.tatoeba.org/sentences/eng/2276049.mp3","pending"
"I don't like eating out.","https://audio.tatoeba.org/sentences/eng/3736827.mp3","pending"
"I don't like Tom at all.","https://audio.tatoeba.org/sentences/eng/2361338.mp3","pending"
"I don't need protection.","https://audio.tatoeba.org/sentences/eng/2271892.mp3","pending"
"I don't think I like it.","https://audio.tatoeba.org/sentences/eng/2361433.mp3","pending"
"I don't understand this.","https://audio.tatoeba.org/sentences/eng/506447.mp3","pending"
"I don't want to see Tom.","https://audio.tatoeba.org/sentences/eng/2011872.mp3","pending"
"I doubt if he will come.","https://audio.tatoeba.org/sentences/eng/284294.mp3","pending"
"I enjoy being a teacher.","https://audio.tatoeba.org/sentences/eng/2325170.mp3","pending"
"I fell in love with you.","https://audio.tatoeba.org/sentences/eng/762039.mp3","pending"
"I find you irresistible.","https://audio.tatoeba.org/sentences/eng/2929401.mp3","pending"
"I found the glass empty.","https://audio.tatoeba.org/sentences/eng/50532.mp3","pending"
"I got married yesterday.","https://audio.tatoeba.org/sentences/eng/3818359.mp3","pending"
"I had my shoes polished.","https://audio.tatoeba.org/sentences/eng/3079086.mp3","pending"
"I hardly recognized Tom.","https://audio.tatoeba.org/sentences/eng/2334075.mp3","pending"
"I hate my mother-in-law.","https://audio.tatoeba.org/sentences/eng/1060547.mp3","pending"
"I have a lot of flowers.","https://audio.tatoeba.org/sentences/eng/384878.mp3","pending"
"I have just eaten lunch.","https://audio.tatoeba.org/sentences/eng/255029.mp3","pending"
"I have no ear for music.","https://audio.tatoeba.org/sentences/eng/256326.mp3","pending"
"I have the ace of clubs.","https://audio.tatoeba.org/sentences/eng/2528234.mp3","pending"
"I have to take medicine.","https://audio.tatoeba.org/sentences/eng/5999.mp3","pending"
"I haven't spoken to Tom.","https://audio.tatoeba.org/sentences/eng/2360368.mp3","pending"
"I heard a strange sound.","https://audio.tatoeba.org/sentences/eng/322678.mp3","pending"
"I hope they arrive soon.","https://audio.tatoeba.org/sentences/eng/436709.mp3","pending"
"I hope you're not alone.","https://audio.tatoeba.org/sentences/eng/2208441.mp3","pending"
"I just want to find Tom.","https://audio.tatoeba.org/sentences/eng/2011881.mp3","pending"
"I knew what I was doing.","https://audio.tatoeba.org/sentences/eng/2375728.mp3","pending"
"I know him only by name.","https://audio.tatoeba.org/sentences/eng/260754.mp3","pending"
"I know that Tom is busy.","https://audio.tatoeba.org/sentences/eng/2546215.mp3","pending"
"I know what that's like.","https://audio.tatoeba.org/sentences/eng/2376312.mp3","pending"
"I know you've got a gun.","https://audio.tatoeba.org/sentences/eng/2376711.mp3","pending"
"I like tennis very much.","https://audio.tatoeba.org/sentences/eng/33551.mp3","pending"
"I like working with Tom.","https://audio.tatoeba.org/sentences/eng/1839499.mp3","pending"
"I locked the front door.","https://audio.tatoeba.org/sentences/eng/1887544.mp3","pending"
"I made friends with her.","https://audio.tatoeba.org/sentences/eng/261126.mp3","pending"
"I miss talking with you.","https://audio.tatoeba.org/sentences/eng/2969030.mp3","pending"
"I missed the last train.","https://audio.tatoeba.org/sentences/eng/411317.mp3","pending"
"I need some good advice.","https://audio.tatoeba.org/sentences/eng/25286.mp3","pending"
"I need to wash my hands.","https://audio.tatoeba.org/sentences/eng/2361659.mp3","pending"
"I never worked with Tom.","https://audio.tatoeba.org/sentences/eng/3330047.mp3","pending"
"I often think about you.","https://audio.tatoeba.org/sentences/eng/3818117.mp3","pending"
"I play sports every day.","https://audio.tatoeba.org/sentences/eng/871719.mp3","pending"
"I question your loyalty.","https://audio.tatoeba.org/sentences/eng/2389909.mp3","pending"
"I refuse to accept that.","https://audio.tatoeba.org/sentences/eng/2392558.mp3","pending"
"I remember his name now.","https://audio.tatoeba.org/sentences/eng/3330271.mp3","pending"
"I saw tears in her eyes.","https://audio.tatoeba.org/sentences/eng/309814.mp3","pending"
"I slept well last night.","https://audio.tatoeba.org/sentences/eng/244854.mp3","pending"
"I still have my dignity.","https://audio.tatoeba.org/sentences/eng/2406639.mp3","pending"
"I suppose you're hungry.","https://audio.tatoeba.org/sentences/eng/16196.mp3","pending"
"I think I miscalculated.","https://audio.tatoeba.org/sentences/eng/3184325.mp3","pending"
"I think my parents know.","https://audio.tatoeba.org/sentences/eng/2812972.mp3","pending"
"I think Tom is artistic.","https://audio.tatoeba.org/sentences/eng/3171967.mp3","pending"
"I think Tom killed Mary.","https://audio.tatoeba.org/sentences/eng/2408300.mp3","pending"
"I think we should leave.","https://audio.tatoeba.org/sentences/eng/2053877.mp3","pending"
"I think you're mistaken.","https://audio.tatoeba.org/sentences/eng/2458589.mp3","pending"
"I thought you hated Tom.","https://audio.tatoeba.org/sentences/eng/1961618.mp3","pending"
"I thought you'd be busy.","https://audio.tatoeba.org/sentences/eng/2645503.mp3","pending"
"I told you to stay here.","https://audio.tatoeba.org/sentences/eng/2612081.mp3","pending"
"I want a second helping.","https://audio.tatoeba.org/sentences/eng/4365896.mp3","pending"
"I want to do everything.","https://audio.tatoeba.org/sentences/eng/3551517.mp3","pending"
"I want to eat something.","https://audio.tatoeba.org/sentences/eng/256362.mp3","pending"
"I want to go to college.","https://audio.tatoeba.org/sentences/eng/259326.mp3","pending"
"I want to see the movie.","https://audio.tatoeba.org/sentences/eng/254230.mp3","pending"
"I want to work with you.","https://audio.tatoeba.org/sentences/eng/2396150.mp3","pending"
"I want you to leave now.","https://audio.tatoeba.org/sentences/eng/2011938.mp3","pending"
"I wanted to read a book.","https://audio.tatoeba.org/sentences/eng/961945.mp3","pending"
"I was at home yesterday.","https://audio.tatoeba.org/sentences/eng/2611763.mp3","pending"
"I was only gone an hour.","https://audio.tatoeba.org/sentences/eng/2546160.mp3","pending"
"I was up half the night.","https://audio.tatoeba.org/sentences/eng/2546148.mp3","pending"
"I wasn't looking at you.","https://audio.tatoeba.org/sentences/eng/2230250.mp3","pending"
"I went to bed very late.","https://audio.tatoeba.org/sentences/eng/2464693.mp3","pending"
"I wish I hadn't hit Tom.","https://audio.tatoeba.org/sentences/eng/3734671.mp3","pending"
"I wish you were with me.","https://audio.tatoeba.org/sentences/eng/3769699.mp3","pending"
"I won't stay here alone.","https://audio.tatoeba.org/sentences/eng/2208446.mp3","pending"
"I'd have waited for you.","https://audio.tatoeba.org/sentences/eng/2546119.mp3","pending"
"I'd like to believe you.","https://audio.tatoeba.org/sentences/eng/1890847.mp3","pending"
"I'd like to return this.","https://audio.tatoeba.org/sentences/eng/726537.mp3","pending"
"I'd rather stay than go.","https://audio.tatoeba.org/sentences/eng/516345.mp3","pending"
"I'll be counting on you.","https://audio.tatoeba.org/sentences/eng/2546103.mp3","pending"
"I'll buy some ice cream.","https://audio.tatoeba.org/sentences/eng/3091023.mp3","pending"
"I'll get dinner started.","https://audio.tatoeba.org/sentences/eng/2546083.mp3","pending"
"I'll leave it up to you.","https://audio.tatoeba.org/sentences/eng/1274224.mp3","pending"
"I'll see you guys later.","https://audio.tatoeba.org/sentences/eng/2546051.mp3","pending"
"I'll stay and watch Tom.","https://audio.tatoeba.org/sentences/eng/2546049.mp3","pending"
"I'll work something out.","https://audio.tatoeba.org/sentences/eng/2064666.mp3","pending"
"I'm afraid you're wrong.","https://audio.tatoeba.org/sentences/eng/2546037.mp3","pending"
"I'm at the hospital now.","https://audio.tatoeba.org/sentences/eng/2546033.mp3","pending"
"I'm from the West Coast.","https://audio.tatoeba.org/sentences/eng/1912020.mp3","pending"
"I'm glad you came today.","https://audio.tatoeba.org/sentences/eng/3304010.mp3","pending"
"I'm glad you're pleased.","https://audio.tatoeba.org/sentences/eng/2546006.mp3","pending"
"I'm good at mathematics.","https://audio.tatoeba.org/sentences/eng/944962.mp3","pending"
"I'm looking for a house.","https://audio.tatoeba.org/sentences/eng/256507.mp3","pending"
"I'm not as smart as you.","https://audio.tatoeba.org/sentences/eng/3500611.mp3","pending"
"I'm not going to eat it.","https://audio.tatoeba.org/sentences/eng/2545956.mp3","pending"
"I'm not really that old.","https://audio.tatoeba.org/sentences/eng/2545948.mp3","pending"
"I'm not working tonight.","https://audio.tatoeba.org/sentences/eng/2545939.mp3","pending"
"I'm simply doing my job.","https://audio.tatoeba.org/sentences/eng/2545920.mp3","pending"
"I'm so glad you've come.","https://audio.tatoeba.org/sentences/eng/2545916.mp3","pending"
"I'm studying French now.","https://audio.tatoeba.org/sentences/eng/2451621.mp3","pending"
"I'm sure Tom won't mind.","https://audio.tatoeba.org/sentences/eng/1453465.mp3","pending"
"I'm the one who met him.","https://audio.tatoeba.org/sentences/eng/2290936.mp3","pending"
"I'm trying to avoid Tom.","https://audio.tatoeba.org/sentences/eng/2545878.mp3","pending"
"I've always admired Tom.","https://audio.tatoeba.org/sentences/eng/3734536.mp3","pending"
"I've got plenty of time.","https://audio.tatoeba.org/sentences/eng/2359686.mp3","pending"
"I've had coffee already.","https://audio.tatoeba.org/sentences/eng/31658.mp3","pending"
"I've never seen you cry.","https://audio.tatoeba.org/sentences/eng/2360099.mp3","pending"
"Is anyone here a doctor?","https://audio.tatoeba.org/sentences/eng/2995439.mp3","pending"
"Is French hard to learn?","https://audio.tatoeba.org/sentences/eng/4382027.mp3","pending"
"Is that why you're here?","https://audio.tatoeba.org/sentences/eng/3168491.mp3","pending"
"Is this your girlfriend?","https://audio.tatoeba.org/sentences/eng/2645494.mp3","pending"
"It can be done in a day.","https://audio.tatoeba.org/sentences/eng/42833.mp3","pending"
"It doesn't hurt so much.","https://audio.tatoeba.org/sentences/eng/1293122.mp3","pending"
"It looks a little heavy.","https://audio.tatoeba.org/sentences/eng/3387672.mp3","pending"
"It was a fantastic game.","https://audio.tatoeba.org/sentences/eng/4494378.mp3","pending"
"It was her that told me.","https://audio.tatoeba.org/sentences/eng/250103.mp3","pending"
"It's a delicate problem.","https://audio.tatoeba.org/sentences/eng/42305.mp3","pending"
"It's been raining again.","https://audio.tatoeba.org/sentences/eng/3826903.mp3","pending"
"It's no concern of mine.","https://audio.tatoeba.org/sentences/eng/449181.mp3","pending"
"It's possible, isn't it?","https://audio.tatoeba.org/sentences/eng/2396263.mp3","pending"
"It's still dark outside.","https://audio.tatoeba.org/sentences/eng/2713483.mp3","pending"
"Just answer my question.","https://audio.tatoeba.org/sentences/eng/4013627.mp3","pending"
"Keep an eye on the door.","https://audio.tatoeba.org/sentences/eng/3174837.mp3","pending"
"Keep your weapons ready.","https://audio.tatoeba.org/sentences/eng/3737247.mp3","pending"
"Let me think about that.","https://audio.tatoeba.org/sentences/eng/3820156.mp3","pending"
"Let's always be friends.","https://audio.tatoeba.org/sentences/eng/889767.mp3","pending"
"Let's go somewhere, Tom.","https://audio.tatoeba.org/sentences/eng/2007593.mp3","pending"
"Let's not talk about it.","https://audio.tatoeba.org/sentences/eng/2007577.mp3","pending"
"Let's try this one here.","https://audio.tatoeba.org/sentences/eng/3166217.mp3","pending"
"Mary has two boyfriends.","https://audio.tatoeba.org/sentences/eng/2475738.mp3","pending"
"May I ask you something?","https://audio.tatoeba.org/sentences/eng/39949.mp3","pending"
"May I go out for a walk?","https://audio.tatoeba.org/sentences/eng/245150.mp3","pending"
"May I use a credit card?","https://audio.tatoeba.org/sentences/eng/993958.mp3","pending"
"Most of my pain is gone.","https://audio.tatoeba.org/sentences/eng/4499020.mp3","pending"
"My camera is waterproof.","https://audio.tatoeba.org/sentences/eng/250295.mp3","pending"
"My father isn't at home.","https://audio.tatoeba.org/sentences/eng/1079091.mp3","pending"
"My major is agriculture.","https://audio.tatoeba.org/sentences/eng/251317.mp3","pending"
"My parents are divorced.","https://audio.tatoeba.org/sentences/eng/456461.mp3","pending"
"My uncle gave me a book.","https://audio.tatoeba.org/sentences/eng/65060.mp3","pending"
"No one came except Mary.","https://audio.tatoeba.org/sentences/eng/324988.mp3","pending"
"No one will believe you.","https://audio.tatoeba.org/sentences/eng/1773684.mp3","pending"
"Nobody cares about that.","https://audio.tatoeba.org/sentences/eng/1359494.mp3","pending"
"Nobody wants to do that.","https://audio.tatoeba.org/sentences/eng/1839556.mp3","pending"
"Now go brush your teeth.","https://audio.tatoeba.org/sentences/eng/3820341.mp3","pending"
"Of course, I understand.","https://audio.tatoeba.org/sentences/eng/3819010.mp3","pending"
"Playing baseball is fun.","https://audio.tatoeba.org/sentences/eng/324087.mp3","pending"
"Please ask Tom to leave.","https://audio.tatoeba.org/sentences/eng/4530018.mp3","pending"
"Please come and help me.","https://audio.tatoeba.org/sentences/eng/413761.mp3","pending"
"Please hold on a moment.","https://audio.tatoeba.org/sentences/eng/279342.mp3","pending"
"Please say hello to her.","https://audio.tatoeba.org/sentences/eng/308827.mp3","pending"
"Please stay out of this.","https://audio.tatoeba.org/sentences/eng/3184994.mp3","pending"
"Please watch this movie.","https://audio.tatoeba.org/sentences/eng/2661873.mp3","pending"
"Say hello to Tom for me.","https://audio.tatoeba.org/sentences/eng/2822147.mp3","pending"
"She forgot to write him.","https://audio.tatoeba.org/sentences/eng/887126.mp3","pending"
"She has attractive eyes.","https://audio.tatoeba.org/sentences/eng/317194.mp3","pending"
"She is very intelligent.","https://audio.tatoeba.org/sentences/eng/311795.mp3","pending"
"She kept silent all day.","https://audio.tatoeba.org/sentences/eng/312598.mp3","pending"
"She usually wears jeans.","https://audio.tatoeba.org/sentences/eng/310395.mp3","pending"
"Show me another example.","https://audio.tatoeba.org/sentences/eng/320313.mp3","pending"
"Sit down and talk to me.","https://audio.tatoeba.org/sentences/eng/3181235.mp3","pending"
"Someone should tell Tom.","https://audio.tatoeba.org/sentences/eng/3200035.mp3","pending"
"Stay away from the fire.","https://audio.tatoeba.org/sentences/eng/23888.mp3","pending"
"Study English every day.","https://audio.tatoeba.org/sentences/eng/322417.mp3","pending"
"Take whichever you want.","https://audio.tatoeba.org/sentences/eng/37992.mp3","pending"
"Tell me what to do here.","https://audio.tatoeba.org/sentences/eng/1845484.mp3","pending"
"Tell us what that means.","https://audio.tatoeba.org/sentences/eng/3200018.mp3","pending"
"Thanks for reminding me.","https://audio.tatoeba.org/sentences/eng/2645462.mp3","pending"
"Thanks for the feedback.","https://audio.tatoeba.org/sentences/eng/2812087.mp3","pending"
"That could be dangerous.","https://audio.tatoeba.org/sentences/eng/3226417.mp3","pending"
"That really isn't funny.","https://audio.tatoeba.org/sentences/eng/3591064.mp3","pending"
"That request was denied.","https://audio.tatoeba.org/sentences/eng/4497186.mp3","pending"
"That was what Tom meant.","https://audio.tatoeba.org/sentences/eng/3736649.mp3","pending"
"That's a wonderful idea.","https://audio.tatoeba.org/sentences/eng/3594069.mp3","pending"
"That's all I should say.","https://audio.tatoeba.org/sentences/eng/3887952.mp3","pending"
"That's how it should be.","https://audio.tatoeba.org/sentences/eng/2160866.mp3","pending"
"That's not the question.","https://audio.tatoeba.org/sentences/eng/3531916.mp3","pending"
"That's what Tom thought.","https://audio.tatoeba.org/sentences/eng/2876096.mp3","pending"
"The baby began to crawl.","https://audio.tatoeba.org/sentences/eng/45867.mp3","pending"
"The boy is eating bread.","https://audio.tatoeba.org/sentences/eng/881343.mp3","pending"
"The children are asleep.","https://audio.tatoeba.org/sentences/eng/2645453.mp3","pending"
"The desk drawer is open.","https://audio.tatoeba.org/sentences/eng/20590.mp3","pending"
"The floor was very cold.","https://audio.tatoeba.org/sentences/eng/2561957.mp3","pending"
"The group was too large.","https://audio.tatoeba.org/sentences/eng/3722383.mp3","pending"
"The keys were in my bag.","https://audio.tatoeba.org/sentences/eng/2645450.mp3","pending"
"The news quickly spread.","https://audio.tatoeba.org/sentences/eng/35952.mp3","pending"
"The pleasure's all mine.","https://audio.tatoeba.org/sentences/eng/2892109.mp3","pending"
"The ship dropped anchor.","https://audio.tatoeba.org/sentences/eng/273415.mp3","pending"
"The teapot is whistling.","https://audio.tatoeba.org/sentences/eng/1979784.mp3","pending"
"The weather became warm.","https://audio.tatoeba.org/sentences/eng/278936.mp3","pending"
"There are three options.","https://audio.tatoeba.org/sentences/eng/4013948.mp3","pending"
"There were lots of jobs.","https://audio.tatoeba.org/sentences/eng/806871.mp3","pending"
"There were no solutions.","https://audio.tatoeba.org/sentences/eng/4494335.mp3","pending"
"There's no other damage.","https://audio.tatoeba.org/sentences/eng/4016533.mp3","pending"
"There's nothing to fear.","https://audio.tatoeba.org/sentences/eng/3286823.mp3","pending"
"These are library books.","https://audio.tatoeba.org/sentences/eng/1818736.mp3","pending"
"They are in the kitchen.","https://audio.tatoeba.org/sentences/eng/275405.mp3","pending"
"They changed the system.","https://audio.tatoeba.org/sentences/eng/305809.mp3","pending"
"They don't miss a thing.","https://audio.tatoeba.org/sentences/eng/2278280.mp3","pending"
"They offered to help us.","https://audio.tatoeba.org/sentences/eng/4499314.mp3","pending"
"They reached their goal.","https://audio.tatoeba.org/sentences/eng/389168.mp3","pending"
"They tried to poison us.","https://audio.tatoeba.org/sentences/eng/3818882.mp3","pending"
"They're friends of mine.","https://audio.tatoeba.org/sentences/eng/2645438.mp3","pending"
"They're very, very good.","https://audio.tatoeba.org/sentences/eng/2545833.mp3","pending"
"Things are changing now.","https://audio.tatoeba.org/sentences/eng/4496441.mp3","pending"
"This car is my father's.","https://audio.tatoeba.org/sentences/eng/58719.mp3","pending"
"This food smells rotten.","https://audio.tatoeba.org/sentences/eng/58377.mp3","pending"
"This is all that's left.","https://audio.tatoeba.org/sentences/eng/3350114.mp3","pending"
"This is not good at all.","https://audio.tatoeba.org/sentences/eng/1682678.mp3","pending"
"This is where I grew up.","https://audio.tatoeba.org/sentences/eng/3818949.mp3","pending"
"This might prove useful.","https://audio.tatoeba.org/sentences/eng/1453348.mp3","pending"
"This sounds about right.","https://audio.tatoeba.org/sentences/eng/1346178.mp3","pending"
"This turkey tastes good.","https://audio.tatoeba.org/sentences/eng/58817.mp3","pending"
"Those flowers have died.","https://audio.tatoeba.org/sentences/eng/42008.mp3","pending"
"Tom and I are Canadians.","https://audio.tatoeba.org/sentences/eng/2955561.mp3","pending"
"Tom asked Mary to dance.","https://audio.tatoeba.org/sentences/eng/2821561.mp3","pending"
"Tom bought a larger car.","https://audio.tatoeba.org/sentences/eng/3735433.mp3","pending"
"Tom buys our vegetables.","https://audio.tatoeba.org/sentences/eng/3150592.mp3","pending"
"Tom can't be that naive.","https://audio.tatoeba.org/sentences/eng/1095620.mp3","pending"
"Tom chuckled to himself.","https://audio.tatoeba.org/sentences/eng/1095281.mp3","pending"
"Tom could've killed you.","https://audio.tatoeba.org/sentences/eng/2645400.mp3","pending"
"Tom crossed his fingers.","https://audio.tatoeba.org/sentences/eng/2645397.mp3","pending"
"Tom didn't go after all.","https://audio.tatoeba.org/sentences/eng/2645395.mp3","pending"
"Tom didn't want to wait.","https://audio.tatoeba.org/sentences/eng/2545820.mp3","pending"
"Tom doesn't drink a lot.","https://audio.tatoeba.org/sentences/eng/3442374.mp3","pending"
"Tom doesn't know French.","https://audio.tatoeba.org/sentences/eng/1026120.mp3","pending"
"Tom earns a good salary.","https://audio.tatoeba.org/sentences/eng/3171596.mp3","pending"
"Tom focused on his work.","https://audio.tatoeba.org/sentences/eng/3402600.mp3","pending"
"Tom gave me good advice.","https://audio.tatoeba.org/sentences/eng/2711721.mp3","pending"
"Tom got into Mary's car.","https://audio.tatoeba.org/sentences/eng/1028856.mp3","pending"
"Tom had a splendid idea.","https://audio.tatoeba.org/sentences/eng/3721297.mp3","pending"
"Tom has a decent salary.","https://audio.tatoeba.org/sentences/eng/1144613.mp3","pending"
"Tom has finished eating.","https://audio.tatoeba.org/sentences/eng/3824998.mp3","pending"
"Tom has low self-esteem.","https://audio.tatoeba.org/sentences/eng/3222882.mp3","pending"
"Tom hasn't given up yet.","https://audio.tatoeba.org/sentences/eng/3151239.mp3","pending"
"Tom hid under the table.","https://audio.tatoeba.org/sentences/eng/37241.mp3","pending"
